{
    "schema_version": "0.1.0",
    "audit_id": "a1b2c3d4-e5f6-7890-abcd-ef1234567890",
    "job_id": "550e8400-e29b-41d4-a716-446655440000",
    "skill_id": "tech_seo_audit",
    "skill_version": "0.1.0",
    "created_at": "2026-02-15T13:00:00Z",
    "provenance": {
        "source_url": "https://github.com/example/seo-tool",
        "commit_sha": "a1b2c3d4e5f6a1b2c3d4e5f6a1b2c3d4e5f6a1b2",
        "branch": "main",
        "fetched_at": "2026-02-15T12:55:00Z",
        "license_spdx": "MIT"
    },
    "manifest": {
        "name": "tech_seo_audit",
        "version": "0.1.0",
        "description": "Technical SEO audit skill",
        "capabilities": [
            "http_fetch",
            "html_parse",
            "schema_validate"
        ],
        "risk_tier": "L1",
        "quality_gate_level": 3
    },
    "license_status": "APPROVED"
}